{"kind":"ArtifactTypeSpec","id":"artifact.requirement_interpretation","version":"1","type_name":"RequirementInterpretation","schema_ref":"schemas/artifact_content_types.v1.schema.json#/$defs/RequirementInterpretation","identity":{"hash_fields":["content"]},"compatibility":{"backward_compatible_with":[]},"metadata":{"v0_3":true}}
