{"kind":"ArtifactTypeSpec","id":"artifact.architecture_decision","version":"1","type_name":"ArchitectureDecision","schema_ref":"schemas/artifact_content_types.v1.schema.json#/$defs/ArchitectureDecision","identity":{"hash_fields":["content"]},"compatibility":{"backward_compatible_with":[]},"metadata":{"v0_3":true}}
